{
  "calendar_event_date": "2025-07-31",
  "effective_event_date": "2025-07-31",
  "estimation_window": {
    "end": -20,
    "start": -140
  },
  "event_timing": "during_or_before_market",
  "event_window": {
    "end": 1,
    "start": -1
  },
  "excluded_dates": [],
  "inference": {
    "direction": "two_sided",
    "permutation_B": 20000,
    "seed": 20260816
  },
  "locked": true,
  "model": "market_model",
  "placebo": {
    "enabled": false
  },
  "return_units": "decimal",
  "robustness_windows": [],
  "schema_version": "0.1.0"
}
